18:19:43.978984 IP 209.58.148.226.61120 > 172.31.45.22.5005: Flags [SEW], seq 3064637165, win 65535, options [mss 1360,nop,wscale 6,nop,nop,TS val 1661523348 ecr 0,sackOK,eol], length 0
18:19:43.979015 IP 172.31.45.22.5005 > 209.58.148.226.61120: Flags [S.E], seq 3227114210, ack 3064637166, win 26847, options [mss 8961,sackOK,TS val 2703509212 ecr 1661523348,nop,wscale 7], length 0
18:19:43.979141 IP 209.58.148.226.61123 > 172.31.45.22.5005: Flags [SEW], seq 2890939462, win 65535, options [mss 1360,nop,wscale 6,nop,nop,TS val 1661523349 ecr 0,sackOK,eol], length 0
18:19:43.979146 IP 172.31.45.22.5005 > 209.58.148.226.61123: Flags [S.E], seq 507776476, ack 2890939463, win 26847, options [mss 8961,sackOK,TS val 2703509212 ecr 1661523349,nop,wscale 7], length 0
18:19:43.979424 IP 209.58.148.226.61124 > 172.31.45.22.5005: Flags [SEW], seq 3042446673, win 65535, options [mss 1360,nop,wscale 6,nop,nop,TS val 1661523349 ecr 0,sackOK,eol], length 0
18:19:43.979428 IP 172.31.45.22.5005 > 209.58.148.226.61124: Flags [S.E], seq 9663068, ack 3042446674, win 26847, options [mss 8961,sackOK,TS val 2703509212 ecr 1661523349,nop,wscale 7], length 0
18:19:43.979605 IP 209.58.148.226.61125 > 172.31.45.22.5005: Flags [SEW], seq 790308988, win 65535, options [mss 1360,nop,wscale 6,nop,nop,TS val 1661523349 ecr 0,sackOK,eol], length 0
18:19:43.979608 IP 172.31.45.22.5005 > 209.58.148.226.61125: Flags [S.E], seq 2367942544, ack 790308989, win 26847, options [mss 8961,sackOK,TS val 2703509212 ecr 1661523349,nop,wscale 7], length 0
18:19:43.979710 IP 209.58.148.226.61119 > 172.31.45.22.5005: Flags [SEW], seq 672200493, win 65535, options [mss 1360,nop,wscale 6,nop,nop,TS val 1661523348 ecr 0,sackOK,eol], length 0
18:19:43.979713 IP 172.31.45.22.5005 > 209.58.148.226.61119: Flags [S.E], seq 1654854440, ack 672200494, win 26847, options [mss 8961,sackOK,TS val 2703509213 ecr 1661523348,nop,wscale 7], length 0
18:19:43.979901 IP 209.58.148.226.61121 > 172.31.45.22.5005: Flags [SEW], seq 2405817453, win 65535, options [mss 1360,nop,wscale 6,nop,nop,TS val 1661523348 ecr 0,sackOK,eol], length 0
18:19:43.979905 IP 172.31.45.22.5005 > 209.58.148.226.61121: Flags [S.E], seq 4253393768, ack 2405817454, win 26847, options [mss 8961,sackOK,TS val 2703509213 ecr 1661523348,nop,wscale 7], length 0
18:19:43.980152 IP 209.58.148.226.61122 > 172.31.45.22.5005: Flags [SEW], seq 3979214861, win 65535, options [mss 1360,nop,wscale 6,nop,nop,TS val 1661523348 ecr 0,sackOK,eol], length 0
18:19:43.980156 IP 172.31.45.22.5005 > 209.58.148.226.61122: Flags [S.E], seq 4227332420, ack 3979214862, win 26847, options [mss 8961,sackOK,TS val 2703509213 ecr 1661523348,nop,wscale 7], length 0
18:19:43.980332 IP 209.58.148.226.61126 > 172.31.45.22.5005: Flags [SEW], seq 3844422306, win 65535, options [mss 1360,nop,wscale 6,nop,nop,TS val 1661523349 ecr 0,sackOK,eol], length 0
18:19:43.980335 IP 172.31.45.22.5005 > 209.58.148.226.61126: Flags [S.E], seq 3668168846, ack 3844422307, win 26847, options [mss 8961,sackOK,TS val 2703509213 ecr 1661523349,nop,wscale 7], length 0
18:19:43.980501 IP 209.58.148.226.61131 > 172.31.45.22.5005: Flags [SEW], seq 1580066999, win 65535, options [mss 1360,nop,wscale 6,nop,nop,TS val 1661523350 ecr 0,sackOK,eol], length 0
18:19:43.980505 IP 172.31.45.22.5005 > 209.58.148.226.61131: Flags [S.E], seq 4110445890, ack 1580067000, win 26847, options [mss 8961,sackOK,TS val 2703509213 ecr 1661523350,nop,wscale 7], length 0
18:19:43.980528 IP 209.58.148.226.61130 > 172.31.45.22.5005: Flags [SEW], seq 2697683478, win 65535, options [mss 1360,nop,wscale 6,nop,nop,TS val 1661523350 ecr 0,sackOK,eol], length 0
18:19:43.980531 IP 172.31.45.22.5005 > 209.58.148.226.61130: Flags [S.E], seq 2395044099, ack 2697683479, win 26847, options [mss 8961,sackOK,TS val 2703509213 ecr 1661523350,nop,wscale 7], length 0
18:19:43.980637 IP 209.58.148.226.61132 > 172.31.45.22.5005: Flags [SEW], seq 1100652222, win 65535, options [mss 1360,nop,wscale 6,nop,nop,TS val 1661523350 ecr 0,sackOK,eol], length 0
18:19:43.980650 IP 172.31.45.22.5005 > 209.58.148.226.61132: Flags [S.E], seq 2954635370, ack 1100652223, win 26847, options [mss 8961,sackOK,TS val 2703509213 ecr 1661523350,nop,wscale 7], length 0
18:19:43.980893 IP 209.58.148.226.61127 > 172.31.45.22.5005: Flags [SEW], seq 4000002280, win 65535, options [mss 1360,nop,wscale 6,nop,nop,TS val 1661523349 ecr 0,sackOK,eol], length 0
18:19:43.980898 IP 172.31.45.22.5005 > 209.58.148.226.61127: Flags [S.E], seq 2968513108, ack 4000002281, win 26847, options [mss 8961,sackOK,TS val 2703509214 ecr 1661523349,nop,wscale 7], length 0
18:19:43.980956 IP 209.58.148.226.61134 > 172.31.45.22.5005: Flags [SEW], seq 1175010380, win 65535, options [mss 1360,nop,wscale 6,nop,nop,TS val 1661523350 ecr 0,sackOK,eol], length 0
18:19:43.980960 IP 172.31.45.22.5005 > 209.58.148.226.61134: Flags [S.E], seq 18047326, ack 1175010381, win 26847, options [mss 8961,sackOK,TS val 2703509214 ecr 1661523350,nop,wscale 7], length 0
18:19:43.980990 IP 209.58.148.226.61128 > 172.31.45.22.5005: Flags [SEW], seq 1368035043, win 65535, options [mss 1360,nop,wscale 6,nop,nop,TS val 1661523349 ecr 0,sackOK,eol], length 0
18:19:43.980993 IP 172.31.45.22.5005 > 209.58.148.226.61128: Flags [S.E], seq 3270928747, ack 1368035044, win 26847, options [mss 8961,sackOK,TS val 2703509214 ecr 1661523349,nop,wscale 7], length 0
18:19:43.981133 IP 209.58.148.226.61135 > 172.31.45.22.5005: Flags [SEW], seq 1056367432, win 65535, options [mss 1360,nop,wscale 6,nop,nop,TS val 1661523350 ecr 0,sackOK,eol], length 0
18:19:43.981137 IP 172.31.45.22.5005 > 209.58.148.226.61135: Flags [S.E], seq 2319895811, ack 1056367433, win 26847, options [mss 8961,sackOK,TS val 2703509214 ecr 1661523350,nop,wscale 7], length 0
18:19:43.981488 IP 209.58.148.226.61129 > 172.31.45.22.5005: Flags [SEW], seq 1188963786, win 65535, options [mss 1360,nop,wscale 6,nop,nop,TS val 1661523350 ecr 0,sackOK,eol], length 0
18:19:43.981492 IP 172.31.45.22.5005 > 209.58.148.226.61129: Flags [S.E], seq 2069146331, ack 1188963787, win 26847, options [mss 8961,sackOK,TS val 2703509214 ecr 1661523350,nop,wscale 7], length 0
18:19:43.983128 IP 209.58.148.226.61133 > 172.31.45.22.5005: Flags [SEW], seq 3166522525, win 65535, options [mss 1360,nop,wscale 6,nop,nop,TS val 1661523350 ecr 0,sackOK,eol], length 0
18:19:43.983137 IP 172.31.45.22.5005 > 209.58.148.226.61133: Flags [S.E], seq 4030410610, ack 3166522526, win 26847, options [mss 8961,sackOK,TS val 2703509216 ecr 1661523350,nop,wscale 7], length 0
18:19:43.983760 IP 209.58.148.226.61136 > 172.31.45.22.5005: Flags [SEW], seq 4158438473, win 65535, options [mss 1360,nop,wscale 6,nop,nop,TS val 1661523351 ecr 0,sackOK,eol], length 0
18:19:43.983767 IP 172.31.45.22.5005 > 209.58.148.226.61136: Flags [S.E], seq 3410795819, ack 4158438474, win 26847, options [mss 8961,sackOK,TS val 2703509217 ecr 1661523351,nop,wscale 7], length 0
18:19:43.984944 IP 209.58.148.226.61138 > 172.31.45.22.5005: Flags [SEW], seq 212951544, win 65535, options [mss 1360,nop,wscale 6,nop,nop,TS val 1661523351 ecr 0,sackOK,eol], length 0
18:19:43.984950 IP 172.31.45.22.5005 > 209.58.148.226.61138: Flags [S.E], seq 2522730746, ack 212951545, win 26847, options [mss 8961,sackOK,TS val 2703509218 ecr 1661523351,nop,wscale 7], length 0
18:19:43.984960 IP 209.58.148.226.61137 > 172.31.45.22.5005: Flags [SEW], seq 712103677, win 65535, options [mss 1360,nop,wscale 6,nop,nop,TS val 1661523351 ecr 0,sackOK,eol], length 0
18:19:43.984963 IP 172.31.45.22.5005 > 209.58.148.226.61137: Flags [S.E], seq 2966973228, ack 712103678, win 26847, options [mss 8961,sackOK,TS val 2703509218 ecr 1661523351,nop,wscale 7], length 0
18:19:44.042886 IP 209.58.148.226.61120 > 172.31.45.22.5005: Flags [.], ack 1, win 2064, options [nop,nop,TS val 1661523411 ecr 2703509212], length 0
18:19:44.043079 IP 209.58.148.226.61123 > 172.31.45.22.5005: Flags [.], ack 1, win 2064, options [nop,nop,TS val 1661523411 ecr 2703509212], length 0
18:19:44.043089 IP 209.58.148.226.61124 > 172.31.45.22.5005: Flags [.], ack 1, win 2064, options [nop,nop,TS val 1661523411 ecr 2703509212], length 0
18:19:44.043431 IP 172.31.45.22.5005 > 209.58.148.226.61120: Flags [F.], seq 1, ack 1, win 210, options [nop,nop,TS val 2703509276 ecr 1661523411], length 0
18:19:44.043614 IP 172.31.45.22.5005 > 209.58.148.226.61123: Flags [F.], seq 1, ack 1, win 210, options [nop,nop,TS val 2703509276 ecr 1661523411], length 0
18:19:44.043699 IP 172.31.45.22.5005 > 209.58.148.226.61124: Flags [F.], seq 1, ack 1, win 210, options [nop,nop,TS val 2703509277 ecr 1661523411], length 0
18:19:44.043718 IP 209.58.148.226.61125 > 172.31.45.22.5005: Flags [.], ack 1, win 2064, options [nop,nop,TS val 1661523411 ecr 2703509212], length 0
18:19:44.043857 IP 172.31.45.22.5005 > 209.58.148.226.61125: Flags [F.], seq 1, ack 1, win 210, options [nop,nop,TS val 2703509277 ecr 1661523411], length 0
18:19:44.044943 IP 209.58.148.226.61119 > 172.31.45.22.5005: Flags [.], ack 1, win 2064, options [nop,nop,TS val 1661523412 ecr 2703509213], length 0
18:19:44.045050 IP 172.31.45.22.5005 > 209.58.148.226.61119: Flags [F.], seq 1, ack 1, win 210, options [nop,nop,TS val 2703509278 ecr 1661523412], length 0
18:19:44.045415 IP 209.58.148.226.61121 > 172.31.45.22.5005: Flags [.], ack 1, win 2064, options [nop,nop,TS val 1661523412 ecr 2703509213], length 0
18:19:44.045518 IP 172.31.45.22.5005 > 209.58.148.226.61121: Flags [F.], seq 1, ack 1, win 210, options [nop,nop,TS val 2703509278 ecr 1661523412], length 0
18:19:44.045921 IP 209.58.148.226.61131 > 172.31.45.22.5005: Flags [.], ack 1, win 2064, options [nop,nop,TS val 1661523413 ecr 2703509213], length 0
18:19:44.046022 IP 172.31.45.22.5005 > 209.58.148.226.61131: Flags [F.], seq 1, ack 1, win 210, options [nop,nop,TS val 2703509279 ecr 1661523413], length 0
18:19:44.046052 IP 209.58.148.226.61126 > 172.31.45.22.5005: Flags [.], ack 1, win 2064, options [nop,nop,TS val 1661523413 ecr 2703509213], length 0
18:19:44.046165 IP 172.31.45.22.5005 > 209.58.148.226.61126: Flags [F.], seq 1, ack 1, win 210, options [nop,nop,TS val 2703509279 ecr 1661523413], length 0
18:19:44.046337 IP 209.58.148.226.61132 > 172.31.45.22.5005: Flags [.], ack 1, win 2064, options [nop,nop,TS val 1661523413 ecr 2703509213], length 0
18:19:44.046428 IP 209.58.148.226.61130 > 172.31.45.22.5005: Flags [.], ack 1, win 2064, options [nop,nop,TS val 1661523413 ecr 2703509213], length 0
18:19:44.046554 IP 172.31.45.22.5005 > 209.58.148.226.61132: Flags [F.], seq 1, ack 1, win 210, options [nop,nop,TS val 2703509279 ecr 1661523413], length 0
18:19:44.046582 IP 209.58.148.226.61134 > 172.31.45.22.5005: Flags [.], ack 1, win 2064, options [nop,nop,TS val 1661523413 ecr 2703509214], length 0
18:19:44.046591 IP 209.58.148.226.61135 > 172.31.45.22.5005: Flags [.], ack 1, win 2064, options [nop,nop,TS val 1661523413 ecr 2703509214], length 0
18:19:44.046702 IP 172.31.45.22.5005 > 209.58.148.226.61130: Flags [F.], seq 1, ack 1, win 210, options [nop,nop,TS val 2703509280 ecr 1661523413], length 0
18:19:44.046822 IP 172.31.45.22.5005 > 209.58.148.226.61134: Flags [F.], seq 1, ack 1, win 210, options [nop,nop,TS val 2703509280 ecr 1661523413], length 0
18:19:44.046894 IP 172.31.45.22.5005 > 209.58.148.226.61135: Flags [F.], seq 1, ack 1, win 210, options [nop,nop,TS val 2703509280 ecr 1661523413], length 0
18:19:44.046993 IP 209.58.148.226.61122 > 172.31.45.22.5005: Flags [.], ack 1, win 2064, options [nop,nop,TS val 1661523413 ecr 2703509213], length 0
18:19:44.047103 IP 172.31.45.22.5005 > 209.58.148.226.61122: Flags [F.], seq 1, ack 1, win 210, options [nop,nop,TS val 2703509280 ecr 1661523413], length 0
18:19:44.047619 IP 209.58.148.226.61127 > 172.31.45.22.5005: Flags [.], ack 1, win 2064, options [nop,nop,TS val 1661523413 ecr 2703509214], length 0
18:19:44.047693 IP 209.58.148.226.61128 > 172.31.45.22.5005: Flags [.], ack 1, win 2064, options [nop,nop,TS val 1661523413 ecr 2703509214], length 0
18:19:44.047784 IP 172.31.45.22.5005 > 209.58.148.226.61127: Flags [F.], seq 1, ack 1, win 210, options [nop,nop,TS val 2703509281 ecr 1661523413], length 0
18:19:44.047803 IP 209.58.148.226.61129 > 172.31.45.22.5005: Flags [.], ack 1, win 2064, options [nop,nop,TS val 1661523413 ecr 2703509214], length 0
18:19:44.047922 IP 172.31.45.22.5005 > 209.58.148.226.61128: Flags [F.], seq 1, ack 1, win 210, options [nop,nop,TS val 2703509281 ecr 1661523413], length 0
18:19:44.047995 IP 172.31.45.22.5005 > 209.58.148.226.61129: Flags [F.], seq 1, ack 1, win 210, options [nop,nop,TS val 2703509281 ecr 1661523413], length 0
18:19:44.048383 IP 209.58.148.226.61136 > 172.31.45.22.5005: Flags [.], ack 1, win 2064, options [nop,nop,TS val 1661523414 ecr 2703509217], length 0
18:19:44.048471 IP 209.58.148.226.61138 > 172.31.45.22.5005: Flags [.], ack 1, win 2064, options [nop,nop,TS val 1661523415 ecr 2703509218], length 0
18:19:44.048544 IP 172.31.45.22.5005 > 209.58.148.226.61136: Flags [F.], seq 1, ack 1, win 210, options [nop,nop,TS val 2703509281 ecr 1661523414], length 0
18:19:44.048619 IP 172.31.45.22.5005 > 209.58.148.226.61138: Flags [F.], seq 1, ack 1, win 210, options [nop,nop,TS val 2703509281 ecr 1661523415], length 0
18:19:44.049463 IP 209.58.148.226.61133 > 172.31.45.22.5005: Flags [.], ack 1, win 2064, options [nop,nop,TS val 1661523414 ecr 2703509216], length 0
18:19:44.049563 IP 172.31.45.22.5005 > 209.58.148.226.61133: Flags [F.], seq 1, ack 1, win 210, options [nop,nop,TS val 2703509282 ecr 1661523414], length 0
18:19:44.052590 IP 209.58.148.226.61137 > 172.31.45.22.5005: Flags [.], ack 1, win 2064, options [nop,nop,TS val 1661523415 ecr 2703509218], length 0
18:19:44.052693 IP 172.31.45.22.5005 > 209.58.148.226.61137: Flags [F.], seq 1, ack 1, win 210, options [nop,nop,TS val 2703509286 ecr 1661523415], length 0
18:19:44.106534 IP 209.58.148.226.61120 > 172.31.45.22.5005: Flags [.], ack 2, win 2064, options [nop,nop,TS val 1661523473 ecr 2703509276], length 0
18:19:44.106996 IP 209.58.148.226.61123 > 172.31.45.22.5005: Flags [.], ack 2, win 2064, options [nop,nop,TS val 1661523473 ecr 2703509276], length 0
18:19:44.107028 IP 209.58.148.226.61124 > 172.31.45.22.5005: Flags [.], ack 2, win 2064, options [nop,nop,TS val 1661523473 ecr 2703509277], length 0
18:19:44.107118 IP 209.58.148.226.61125 > 172.31.45.22.5005: Flags [.], ack 2, win 2064, options [nop,nop,TS val 1661523473 ecr 2703509277], length 0
18:19:44.109064 IP 209.58.148.226.61119 > 172.31.45.22.5005: Flags [.], ack 2, win 2064, options [nop,nop,TS val 1661523474 ecr 2703509278], length 0
18:19:44.110216 IP 209.58.148.226.61131 > 172.31.45.22.5005: Flags [.], ack 2, win 2064, options [nop,nop,TS val 1661523474 ecr 2703509279], length 0
18:19:44.110466 IP 209.58.148.226.61126 > 172.31.45.22.5005: Flags [.], ack 2, win 2064, options [nop,nop,TS val 1661523476 ecr 2703509279], length 0
18:19:44.110566 IP 209.58.148.226.61132 > 172.31.45.22.5005: Flags [.], ack 2, win 2064, options [nop,nop,TS val 1661523476 ecr 2703509279], length 0
18:19:44.110802 IP 209.58.148.226.61135 > 172.31.45.22.5005: Flags [.], ack 2, win 2064, options [nop,nop,TS val 1661523476 ecr 2703509280], length 0
18:19:44.110807 IP 209.58.148.226.61130 > 172.31.45.22.5005: Flags [.], ack 2, win 2064, options [nop,nop,TS val 1661523476 ecr 2703509280], length 0
18:19:44.110811 IP 209.58.148.226.61134 > 172.31.45.22.5005: Flags [.], ack 2, win 2064, options [nop,nop,TS val 1661523476 ecr 2703509280], length 0
18:19:44.111633 IP 209.58.148.226.61121 > 172.31.45.22.5005: Flags [.], ack 2, win 2064, options [nop,nop,TS val 1661523474 ecr 2703509278], length 0
18:19:44.111925 IP 209.58.148.226.61138 > 172.31.45.22.5005: Flags [.], ack 2, win 2064, options [nop,nop,TS val 1661523477 ecr 2703509281], length 0
18:19:44.111932 IP 209.58.148.226.61122 > 172.31.45.22.5005: Flags [.], ack 2, win 2064, options [nop,nop,TS val 1661523476 ecr 2703509280], length 0
18:19:44.112645 IP 209.58.148.226.61127 > 172.31.45.22.5005: Flags [.], ack 2, win 2064, options [nop,nop,TS val 1661523477 ecr 2703509281], length 0
18:19:44.112669 IP 209.58.148.226.61129 > 172.31.45.22.5005: Flags [.], ack 2, win 2064, options [nop,nop,TS val 1661523477 ecr 2703509281], length 0
18:19:44.112847 IP 209.58.148.226.61136 > 172.31.45.22.5005: Flags [.], ack 2, win 2064, options [nop,nop,TS val 1661523477 ecr 2703509281], length 0
18:19:44.112852 IP 209.58.148.226.61128 > 172.31.45.22.5005: Flags [.], ack 2, win 2064, options [nop,nop,TS val 1661523477 ecr 2703509281], length 0
18:19:44.114902 IP 209.58.148.226.61133 > 172.31.45.22.5005: Flags [.], ack 2, win 2064, options [nop,nop,TS val 1661523477 ecr 2703509282], length 0
18:19:44.118396 IP 209.58.148.226.61137 > 172.31.45.22.5005: Flags [.], ack 2, win 2064, options [nop,nop,TS val 1661523480 ecr 2703509286], length 0
18:19:45.544050 IP 209.58.148.226.61123 > 172.31.45.22.5005: Flags [F.], seq 1, ack 2, win 2064, options [nop,nop,TS val 1661524894 ecr 2703509276], length 0
18:19:45.544075 IP 172.31.45.22.5005 > 209.58.148.226.61123: Flags [.], ack 2, win 210, options [nop,nop,TS val 2703510777 ecr 1661524894], length 0
18:19:45.544547 IP 209.58.148.226.61120 > 172.31.45.22.5005: Flags [F.], seq 1, ack 2, win 2064, options [nop,nop,TS val 1661524894 ecr 2703509276], length 0
18:19:45.544553 IP 172.31.45.22.5005 > 209.58.148.226.61120: Flags [.], ack 2, win 210, options [nop,nop,TS val 2703510777 ecr 1661524894], length 0
18:19:45.544685 IP 209.58.148.226.61124 > 172.31.45.22.5005: Flags [F.], seq 1, ack 2, win 2064, options [nop,nop,TS val 1661524894 ecr 2703509277], length 0
18:19:45.544688 IP 172.31.45.22.5005 > 209.58.148.226.61124: Flags [.], ack 2, win 210, options [nop,nop,TS val 2703510778 ecr 1661524894], length 0
18:19:45.544693 IP 209.58.148.226.61125 > 172.31.45.22.5005: Flags [F.], seq 1, ack 2, win 2064, options [nop,nop,TS val 1661524894 ecr 2703509277], length 0
18:19:45.544695 IP 172.31.45.22.5005 > 209.58.148.226.61125: Flags [.], ack 2, win 210, options [nop,nop,TS val 2703510778 ecr 1661524894], length 0
18:19:45.544770 IP 209.58.148.226.61142 > 172.31.45.22.5005: Flags [SEW], seq 3450374200, win 65535, options [mss 1360,nop,wscale 6,nop,nop,TS val 1661524894 ecr 0,sackOK,eol], length 0
18:19:45.544782 IP 172.31.45.22.5005 > 209.58.148.226.61142: Flags [S.E], seq 1874838413, ack 3450374201, win 26847, options [mss 8961,sackOK,TS val 2703510778 ecr 1661524894,nop,wscale 7], length 0
18:19:45.545080 IP 209.58.148.226.61143 > 172.31.45.22.5005: Flags [SEW], seq 2877829554, win 65535, options [mss 1360,nop,wscale 6,nop,nop,TS val 1661524894 ecr 0,sackOK,eol], length 0
18:19:45.545085 IP 172.31.45.22.5005 > 209.58.148.226.61143: Flags [S.E], seq 14410695, ack 2877829555, win 26847, options [mss 8961,sackOK,TS val 2703510778 ecr 1661524894,nop,wscale 7], length 0
18:19:45.545260 IP 209.58.148.226.61145 > 172.31.45.22.5005: Flags [SEW], seq 1052320356, win 65535, options [mss 1360,nop,wscale 6,nop,nop,TS val 1661524895 ecr 0,sackOK,eol], length 0
18:19:45.545263 IP 172.31.45.22.5005 > 209.58.148.226.61145: Flags [S.E], seq 202679349, ack 1052320357, win 26847, options [mss 8961,sackOK,TS val 2703510778 ecr 1661524895,nop,wscale 7], length 0
18:19:45.545318 IP 209.58.148.226.61131 > 172.31.45.22.5005: Flags [F.], seq 1, ack 2, win 2064, options [nop,nop,TS val 1661524895 ecr 2703509279], length 0
18:19:45.545320 IP 172.31.45.22.5005 > 209.58.148.226.61131: Flags [.], ack 2, win 210, options [nop,nop,TS val 2703510778 ecr 1661524895], length 0
18:19:45.545372 IP 209.58.148.226.61141 > 172.31.45.22.5005: Flags [SEW], seq 412559296, win 65535, options [mss 1360,nop,wscale 6,nop,nop,TS val 1661524894 ecr 0,sackOK,eol], length 0
18:19:45.545376 IP 172.31.45.22.5005 > 209.58.148.226.61141: Flags [S.E], seq 4183528616, ack 412559297, win 26847, options [mss 8961,sackOK,TS val 2703510778 ecr 1661524894,nop,wscale 7], length 0
18:19:45.545380 IP 209.58.148.226.61132 > 172.31.45.22.5005: Flags [F.], seq 1, ack 2, win 2064, options [nop,nop,TS val 1661524895 ecr 2703509279], length 0
18:19:45.545383 IP 172.31.45.22.5005 > 209.58.148.226.61132: Flags [.], ack 2, win 210, options [nop,nop,TS val 2703510778 ecr 1661524895], length 0
18:19:45.545500 IP 209.58.148.226.61126 > 172.31.45.22.5005: Flags [F.], seq 1, ack 2, win 2064, options [nop,nop,TS val 1661524895 ecr 2703509279], length 0
18:19:45.545502 IP 172.31.45.22.5005 > 209.58.148.226.61126: Flags [.], ack 2, win 210, options [nop,nop,TS val 2703510778 ecr 1661524895], length 0
18:19:45.545571 IP 209.58.148.226.61140 > 172.31.45.22.5005: Flags [SEW], seq 3616768387, win 65535, options [mss 1360,nop,wscale 6,nop,nop,TS val 1661524894 ecr 0,sackOK,eol], length 0
18:19:45.545575 IP 172.31.45.22.5005 > 209.58.148.226.61140: Flags [S.E], seq 707865796, ack 3616768388, win 26847, options [mss 8961,sackOK,TS val 2703510778 ecr 1661524894,nop,wscale 7], length 0
18:19:45.546169 IP 209.58.148.226.61119 > 172.31.45.22.5005: Flags [F.], seq 1, ack 2, win 2064, options [nop,nop,TS val 1661524895 ecr 2703509278], length 0
18:19:45.546171 IP 172.31.45.22.5005 > 209.58.148.226.61119: Flags [.], ack 2, win 210, options [nop,nop,TS val 2703510779 ecr 1661524895], length 0
18:19:45.546176 IP 209.58.148.226.61121 > 172.31.45.22.5005: Flags [F.], seq 1, ack 2, win 2064, options [nop,nop,TS val 1661524895 ecr 2703509278], length 0
18:19:45.546177 IP 172.31.45.22.5005 > 209.58.148.226.61121: Flags [.], ack 2, win 210, options [nop,nop,TS val 2703510779 ecr 1661524895], length 0
18:19:45.546179 IP 209.58.148.226.61130 > 172.31.45.22.5005: Flags [F.], seq 1, ack 2, win 2064, options [nop,nop,TS val 1661524895 ecr 2703509280], length 0
18:19:45.546181 IP 172.31.45.22.5005 > 209.58.148.226.61130: Flags [.], ack 2, win 210, options [nop,nop,TS val 2703510779 ecr 1661524895], length 0
18:19:45.546289 IP 209.58.148.226.61144 > 172.31.45.22.5005: Flags [SEW], seq 2742569111, win 65535, options [mss 1360,nop,wscale 6,nop,nop,TS val 1661524895 ecr 0,sackOK,eol], length 0
18:19:45.546293 IP 172.31.45.22.5005 > 209.58.148.226.61144: Flags [S.E], seq 990094808, ack 2742569112, win 26847, options [mss 8961,sackOK,TS val 2703510779 ecr 1661524895,nop,wscale 7], length 0
18:19:45.546393 IP 209.58.148.226.61146 > 172.31.45.22.5005: Flags [SEW], seq 164153852, win 65535, options [mss 1360,nop,wscale 6,nop,nop,TS val 1661524895 ecr 0,sackOK,eol], length 0
18:19:45.546396 IP 172.31.45.22.5005 > 209.58.148.226.61146: Flags [S.E], seq 2545230837, ack 164153853, win 26847, options [mss 8961,sackOK,TS val 2703510779 ecr 1661524895,nop,wscale 7], length 0
18:19:45.546555 IP 209.58.148.226.61122 > 172.31.45.22.5005: Flags [F.], seq 1, ack 2, win 2064, options [nop,nop,TS val 1661524895 ecr 2703509280], length 0
18:19:45.546566 IP 172.31.45.22.5005 > 209.58.148.226.61122: Flags [.], ack 2, win 210, options [nop,nop,TS val 2703510779 ecr 1661524895], length 0
18:19:45.546574 IP 209.58.148.226.61151 > 172.31.45.22.5005: Flags [SEW], seq 651441533, win 65535, options [mss 1360,nop,wscale 6,nop,nop,TS val 1661524896 ecr 0,sackOK,eol], length 0
18:19:45.546581 IP 172.31.45.22.5005 > 209.58.148.226.61151: Flags [S.E], seq 4191467800, ack 651441534, win 26847, options [mss 8961,sackOK,TS val 2703510779 ecr 1661524896,nop,wscale 7], length 0
18:19:45.546601 IP 209.58.148.226.61153 > 172.31.45.22.5005: Flags [SEW], seq 3582719434, win 65535, options [mss 1360,nop,wscale 6,nop,nop,TS val 1661524896 ecr 0,sackOK,eol], length 0
18:19:45.546605 IP 172.31.45.22.5005 > 209.58.148.226.61153: Flags [S.E], seq 3381158810, ack 3582719435, win 26847, options [mss 8961,sackOK,TS val 2703510780 ecr 1661524896,nop,wscale 7], length 0
18:19:45.546611 IP 209.58.148.226.61152 > 172.31.45.22.5005: Flags [SEW], seq 3941945695, win 65535, options [mss 1360,nop,wscale 6,nop,nop,TS val 1661524896 ecr 0,sackOK,eol], length 0
18:19:45.546613 IP 172.31.45.22.5005 > 209.58.148.226.61152: Flags [S.E], seq 1804775493, ack 3941945696, win 26847, options [mss 8961,sackOK,TS val 2703510780 ecr 1661524896,nop,wscale 7], length 0
18:19:45.546745 IP 209.58.148.226.61135 > 172.31.45.22.5005: Flags [F.], seq 1, ack 2, win 2064, options [nop,nop,TS val 1661524896 ecr 2703509280], length 0
18:19:45.546748 IP 172.31.45.22.5005 > 209.58.148.226.61135: Flags [.], ack 2, win 210, options [nop,nop,TS val 2703510780 ecr 1661524896], length 0
18:19:45.546753 IP 209.58.148.226.61134 > 172.31.45.22.5005: Flags [F.], seq 1, ack 2, win 2064, options [nop,nop,TS val 1661524896 ecr 2703509280], length 0
18:19:45.546754 IP 172.31.45.22.5005 > 209.58.148.226.61134: Flags [.], ack 2, win 210, options [nop,nop,TS val 2703510780 ecr 1661524896], length 0
18:19:45.547482 IP 209.58.148.226.61127 > 172.31.45.22.5005: Flags [F.], seq 1, ack 2, win 2064, options [nop,nop,TS val 1661524895 ecr 2703509281], length 0
18:19:45.547485 IP 172.31.45.22.5005 > 209.58.148.226.61127: Flags [.], ack 2, win 210, options [nop,nop,TS val 2703510780 ecr 1661524895], length 0
18:19:45.547571 IP 209.58.148.226.61149 > 172.31.45.22.5005: Flags [SEW], seq 379344677, win 65535, options [mss 1360,nop,wscale 6,nop,nop,TS val 1661524896 ecr 0,sackOK,eol], length 0
18:19:45.547576 IP 172.31.45.22.5005 > 209.58.148.226.61149: Flags [S.E], seq 474607754, ack 379344678, win 26847, options [mss 8961,sackOK,TS val 2703510780 ecr 1661524896,nop,wscale 7], length 0
18:19:45.547696 IP 209.58.148.226.61129 > 172.31.45.22.5005: Flags [F.], seq 1, ack 2, win 2064, options [nop,nop,TS val 1661524896 ecr 2703509281], length 0
18:19:45.547699 IP 172.31.45.22.5005 > 209.58.148.226.61129: Flags [.], ack 2, win 210, options [nop,nop,TS val 2703510781 ecr 1661524896], length 0
18:19:45.547889 IP 209.58.148.226.61128 > 172.31.45.22.5005: Flags [F.], seq 1, ack 2, win 2064, options [nop,nop,TS val 1661524896 ecr 2703509281], length 0
18:19:45.547892 IP 172.31.45.22.5005 > 209.58.148.226.61128: Flags [.], ack 2, win 210, options [nop,nop,TS val 2703510781 ecr 1661524896], length 0
18:19:45.547915 IP 209.58.148.226.61155 > 172.31.45.22.5005: Flags [SEW], seq 1123102729, win 65535, options [mss 1360,nop,wscale 6,nop,nop,TS val 1661524896 ecr 0,sackOK,eol], length 0
18:19:45.547919 IP 172.31.45.22.5005 > 209.58.148.226.61155: Flags [S.E], seq 176156616, ack 1123102730, win 26847, options [mss 8961,sackOK,TS val 2703510781 ecr 1661524896,nop,wscale 7], length 0
18:19:45.547923 IP 209.58.148.226.61154 > 172.31.45.22.5005: Flags [SEW], seq 1094151996, win 65535, options [mss 1360,nop,wscale 6,nop,nop,TS val 1661524896 ecr 0,sackOK,eol], length 0
18:19:45.547926 IP 172.31.45.22.5005 > 209.58.148.226.61154: Flags [S.E], seq 1959500801, ack 1094151997, win 26847, options [mss 8961,sackOK,TS val 2703510781 ecr 1661524896,nop,wscale 7], length 0
18:19:45.548174 IP 209.58.148.226.61150 > 172.31.45.22.5005: Flags [SEW], seq 805631145, win 65535, options [mss 1360,nop,wscale 6,nop,nop,TS val 1661524896 ecr 0,sackOK,eol], length 0
18:19:45.548181 IP 172.31.45.22.5005 > 209.58.148.226.61150: Flags [S.E], seq 3405911773, ack 805631146, win 26847, options [mss 8961,sackOK,TS val 2703510781 ecr 1661524896,nop,wscale 7], length 0
18:19:45.548354 IP 209.58.148.226.61156 > 172.31.45.22.5005: Flags [SEW], seq 728492811, win 65535, options [mss 1360,nop,wscale 6,nop,nop,TS val 1661524898 ecr 0,sackOK,eol], length 0
18:19:45.548358 IP 172.31.45.22.5005 > 209.58.148.226.61156: Flags [S.E], seq 2619510316, ack 728492812, win 26847, options [mss 8961,sackOK,TS val 2703510781 ecr 1661524898,nop,wscale 7], length 0
18:19:45.548610 IP 209.58.148.226.61157 > 172.31.45.22.5005: Flags [SEW], seq 2879850320, win 65535, options [mss 1360,nop,wscale 6,nop,nop,TS val 1661524898 ecr 0,sackOK,eol], length 0
18:19:45.548615 IP 172.31.45.22.5005 > 209.58.148.226.61157: Flags [S.E], seq 3338636390, ack 2879850321, win 26847, options [mss 8961,sackOK,TS val 2703510782 ecr 1661524898,nop,wscale 7], length 0
18:19:45.548672 IP 209.58.148.226.61148 > 172.31.45.22.5005: Flags [SEW], seq 857064864, win 65535, options [mss 1360,nop,wscale 6,nop,nop,TS val 1661524895 ecr 0,sackOK,eol], length 0
18:19:45.548675 IP 172.31.45.22.5005 > 209.58.148.226.61148: Flags [S.E], seq 2852202996, ack 857064865, win 26847, options [mss 8961,sackOK,TS val 2703510782 ecr 1661524895,nop,wscale 7], length 0
18:19:45.548680 IP 209.58.148.226.61147 > 172.31.45.22.5005: Flags [SEW], seq 4143233173, win 65535, options [mss 1360,nop,wscale 6,nop,nop,TS val 1661524895 ecr 0,sackOK,eol], length 0
18:19:45.548682 IP 172.31.45.22.5005 > 209.58.148.226.61147: Flags [S.E], seq 3756934330, ack 4143233174, win 26847, options [mss 8961,sackOK,TS val 2703510782 ecr 1661524895,nop,wscale 7], length 0
18:19:45.548931 IP 209.58.148.226.61138 > 172.31.45.22.5005: Flags [F.], seq 1, ack 2, win 2064, options [nop,nop,TS val 1661524898 ecr 2703509281], length 0
18:19:45.548934 IP 172.31.45.22.5005 > 209.58.148.226.61138: Flags [.], ack 2, win 210, options [nop,nop,TS val 2703510782 ecr 1661524898], length 0
18:19:45.548989 IP 209.58.148.226.61158 > 172.31.45.22.5005: Flags [SEW], seq 3478581302, win 65535, options [mss 1360,nop,wscale 6,nop,nop,TS val 1661524898 ecr 0,sackOK,eol], length 0
18:19:45.548992 IP 172.31.45.22.5005 > 209.58.148.226.61158: Flags [S.E], seq 2477611958, ack 3478581303, win 26847, options [mss 8961,sackOK,TS val 2703510782 ecr 1661524898,nop,wscale 7], length 0
18:19:45.549469 IP 209.58.148.226.61136 > 172.31.45.22.5005: Flags [F.], seq 1, ack 2, win 2064, options [nop,nop,TS val 1661524898 ecr 2703509281], length 0
18:19:45.549472 IP 172.31.45.22.5005 > 209.58.148.226.61136: Flags [.], ack 2, win 210, options [nop,nop,TS val 2703510782 ecr 1661524898], length 0
18:19:45.550017 IP 209.58.148.226.61159 > 172.31.45.22.5005: Flags [SEW], seq 2696704900, win 65535, options [mss 1360,nop,wscale 6,nop,nop,TS val 1661524898 ecr 0,sackOK,eol], length 0
18:19:45.550022 IP 172.31.45.22.5005 > 209.58.148.226.61159: Flags [S.E], seq 1579139163, ack 2696704901, win 26847, options [mss 8961,sackOK,TS val 2703510783 ecr 1661524898,nop,wscale 7], length 0
18:19:45.550342 IP 209.58.148.226.61133 > 172.31.45.22.5005: Flags [F.], seq 1, ack 2, win 2064, options [nop,nop,TS val 1661524898 ecr 2703509282], length 0
18:19:45.550345 IP 172.31.45.22.5005 > 209.58.148.226.61133: Flags [.], ack 2, win 210, options [nop,nop,TS val 2703510783 ecr 1661524898], length 0
18:19:45.551927 IP 209.58.148.226.61137 > 172.31.45.22.5005: Flags [F.], seq 1, ack 2, win 2064, options [nop,nop,TS val 1661524898 ecr 2703509286], length 0
18:19:45.551931 IP 172.31.45.22.5005 > 209.58.148.226.61137: Flags [.], ack 2, win 210, options [nop,nop,TS val 2703510785 ecr 1661524898], length 0
18:19:45.610058 IP 209.58.148.226.61142 > 172.31.45.22.5005: Flags [.], ack 1, win 2064, options [nop,nop,TS val 1661524958 ecr 2703510778], length 0
18:19:45.610097 IP 209.58.148.226.61143 > 172.31.45.22.5005: Flags [.], ack 1, win 2064, options [nop,nop,TS val 1661524958 ecr 2703510778], length 0
18:19:45.610472 IP 172.31.45.22.5005 > 209.58.148.226.61142: Flags [F.], seq 1, ack 1, win 210, options [nop,nop,TS val 2703510843 ecr 1661524958], length 0
18:19:45.610607 IP 209.58.148.226.61141 > 172.31.45.22.5005: Flags [.], ack 1, win 2064, options [nop,nop,TS val 1661524958 ecr 2703510778], length 0
18:19:45.610711 IP 172.31.45.22.5005 > 209.58.148.226.61143: Flags [F.], seq 1, ack 1, win 210, options [nop,nop,TS val 2703510844 ecr 1661524958], length 0
18:19:45.610800 IP 172.31.45.22.5005 > 209.58.148.226.61141: Flags [F.], seq 1, ack 1, win 210, options [nop,nop,TS val 2703510844 ecr 1661524958], length 0
18:19:45.611939 IP 209.58.148.226.61145 > 172.31.45.22.5005: Flags [.], ack 1, win 2064, options [nop,nop,TS val 1661524958 ecr 2703510778], length 0
18:19:45.612052 IP 172.31.45.22.5005 > 209.58.148.226.61145: Flags [F.], seq 1, ack 1, win 210, options [nop,nop,TS val 2703510845 ecr 1661524958], length 0
18:19:45.612442 IP 209.58.148.226.61140 > 172.31.45.22.5005: Flags [.], ack 1, win 2064, options [nop,nop,TS val 1661524958 ecr 2703510778], length 0
18:19:45.612548 IP 172.31.45.22.5005 > 209.58.148.226.61140: Flags [F.], seq 1, ack 1, win 210, options [nop,nop,TS val 2703510845 ecr 1661524958], length 0
18:19:45.614307 IP 209.58.148.226.61153 > 172.31.45.22.5005: Flags [.], ack 1, win 2064, options [nop,nop,TS val 1661524961 ecr 2703510780], length 0
18:19:45.614411 IP 172.31.45.22.5005 > 209.58.148.226.61153: Flags [F.], seq 1, ack 1, win 210, options [nop,nop,TS val 2703510847 ecr 1661524961], length 0
18:19:45.614433 IP 209.58.148.226.61146 > 172.31.45.22.5005: Flags [.], ack 1, win 2064, options [nop,nop,TS val 1661524961 ecr 2703510779], length 0
18:19:45.614555 IP 209.58.148.226.61151 > 172.31.45.22.5005: Flags [.], ack 1, win 2064, options [nop,nop,TS val 1661524961 ecr 2703510779], length 0
18:19:45.614658 IP 172.31.45.22.5005 > 209.58.148.226.61146: Flags [F.], seq 1, ack 1, win 210, options [nop,nop,TS val 2703510848 ecr 1661524961], length 0
18:19:45.614680 IP 209.58.148.226.61152 > 172.31.45.22.5005: Flags [.], ack 1, win 2064, options [nop,nop,TS val 1661524961 ecr 2703510780], length 0
18:19:45.614807 IP 172.31.45.22.5005 > 209.58.148.226.61151: Flags [F.], seq 1, ack 1, win 210, options [nop,nop,TS val 2703510848 ecr 1661524961], length 0
18:19:45.614882 IP 172.31.45.22.5005 > 209.58.148.226.61152: Flags [F.], seq 1, ack 1, win 210, options [nop,nop,TS val 2703510848 ecr 1661524961], length 0
18:19:45.615216 IP 209.58.148.226.61156 > 172.31.45.22.5005: Flags [.], ack 1, win 2064, options [nop,nop,TS val 1661524963 ecr 2703510781], length 0
18:19:45.615316 IP 172.31.45.22.5005 > 209.58.148.226.61156: Flags [F.], seq 1, ack 1, win 210, options [nop,nop,TS val 2703510848 ecr 1661524963], length 0
18:19:45.615459 IP 209.58.148.226.61157 > 172.31.45.22.5005: Flags [.], ack 1, win 2064, options [nop,nop,TS val 1661524963 ecr 2703510782], length 0
18:19:45.615503 IP 209.58.148.226.61158 > 172.31.45.22.5005: Flags [.], ack 1, win 2064, options [nop,nop,TS val 1661524963 ecr 2703510782], length 0
18:19:45.615564 IP 209.58.148.226.61144 > 172.31.45.22.5005: Flags [.], ack 1, win 2064, options [nop,nop,TS val 1661524961 ecr 2703510779], length 0
18:19:45.615635 IP 172.31.45.22.5005 > 209.58.148.226.61157: Flags [F.], seq 1, ack 1, win 210, options [nop,nop,TS val 2703510849 ecr 1661524963], length 0
18:19:45.615757 IP 172.31.45.22.5005 > 209.58.148.226.61158: Flags [F.], seq 1, ack 1, win 210, options [nop,nop,TS val 2703510849 ecr 1661524963], length 0
18:19:45.615830 IP 172.31.45.22.5005 > 209.58.148.226.61144: Flags [F.], seq 1, ack 1, win 210, options [nop,nop,TS val 2703510849 ecr 1661524961], length 0
18:19:45.615935 IP 209.58.148.226.61149 > 172.31.45.22.5005: Flags [.], ack 1, win 2064, options [nop,nop,TS val 1661524963 ecr 2703510780], length 0
18:19:45.615947 IP 209.58.148.226.61150 > 172.31.45.22.5005: Flags [.], ack 1, win 2064, options [nop,nop,TS val 1661524963 ecr 2703510781], length 0
18:19:45.616083 IP 172.31.45.22.5005 > 209.58.148.226.61149: Flags [F.], seq 1, ack 1, win 210, options [nop,nop,TS val 2703510849 ecr 1661524963], length 0
18:19:45.616159 IP 172.31.45.22.5005 > 209.58.148.226.61150: Flags [F.], seq 1, ack 1, win 210, options [nop,nop,TS val 2703510849 ecr 1661524963], length 0
18:19:45.616421 IP 209.58.148.226.61155 > 172.31.45.22.5005: Flags [.], ack 1, win 2064, options [nop,nop,TS val 1661524963 ecr 2703510781], length 0
18:19:45.616490 IP 209.58.148.226.61154 > 172.31.45.22.5005: Flags [.], ack 1, win 2064, options [nop,nop,TS val 1661524963 ecr 2703510781], length 0
18:19:45.616584 IP 172.31.45.22.5005 > 209.58.148.226.61155: Flags [F.], seq 1, ack 1, win 210, options [nop,nop,TS val 2703510849 ecr 1661524963], length 0
18:19:45.616607 IP 209.58.148.226.61159 > 172.31.45.22.5005: Flags [.], ack 1, win 2064, options [nop,nop,TS val 1661524963 ecr 2703510783], length 0
18:19:45.616718 IP 172.31.45.22.5005 > 209.58.148.226.61154: Flags [F.], seq 1, ack 1, win 210, options [nop,nop,TS val 2703510850 ecr 1661524963], length 0
18:19:45.616793 IP 172.31.45.22.5005 > 209.58.148.226.61159: Flags [F.], seq 1, ack 1, win 210, options [nop,nop,TS val 2703510850 ecr 1661524963], length 0
18:19:45.617659 IP 209.58.148.226.61147 > 172.31.45.22.5005: Flags [.], ack 1, win 2064, options [nop,nop,TS val 1661524963 ecr 2703510782], length 0
18:19:45.617705 IP 209.58.148.226.61148 > 172.31.45.22.5005: Flags [.], ack 1, win 2064, options [nop,nop,TS val 1661524963 ecr 2703510782], length 0
18:19:45.617824 IP 172.31.45.22.5005 > 209.58.148.226.61147: Flags [F.], seq 1, ack 1, win 210, options [nop,nop,TS val 2703510851 ecr 1661524963], length 0
18:19:45.617902 IP 172.31.45.22.5005 > 209.58.148.226.61148: Flags [F.], seq 1, ack 1, win 210, options [nop,nop,TS val 2703510851 ecr 1661524963], length 0
18:19:45.674251 IP 209.58.148.226.61142 > 172.31.45.22.5005: Flags [.], ack 2, win 2064, options [nop,nop,TS val 1661525021 ecr 2703510843], length 0
18:19:45.674841 IP 209.58.148.226.61145 > 172.31.45.22.5005: Flags [.], ack 2, win 2064, options [nop,nop,TS val 1661525022 ecr 2703510845], length 0
18:19:45.674849 IP 209.58.148.226.61143 > 172.31.45.22.5005: Flags [.], ack 2, win 2064, options [nop,nop,TS val 1661525021 ecr 2703510844], length 0
18:19:45.675432 IP 209.58.148.226.61141 > 172.31.45.22.5005: Flags [.], ack 2, win 2064, options [nop,nop,TS val 1661525021 ecr 2703510844], length 0
18:19:45.676463 IP 209.58.148.226.61140 > 172.31.45.22.5005: Flags [.], ack 2, win 2064, options [nop,nop,TS val 1661525022 ecr 2703510845], length 0
18:19:45.677607 IP 209.58.148.226.61153 > 172.31.45.22.5005: Flags [.], ack 2, win 2064, options [nop,nop,TS val 1661525024 ecr 2703510847], length 0
18:19:45.678530 IP 209.58.148.226.61151 > 172.31.45.22.5005: Flags [.], ack 2, win 2064, options [nop,nop,TS val 1661525024 ecr 2703510848], length 0
18:19:45.678702 IP 209.58.148.226.61146 > 172.31.45.22.5005: Flags [.], ack 2, win 2064, options [nop,nop,TS val 1661525024 ecr 2703510848], length 0
18:19:45.680367 IP 209.58.148.226.61156 > 172.31.45.22.5005: Flags [.], ack 2, win 2064, options [nop,nop,TS val 1661525026 ecr 2703510848], length 0
18:19:45.680373 IP 209.58.148.226.61152 > 172.31.45.22.5005: Flags [.], ack 2, win 2064, options [nop,nop,TS val 1661525024 ecr 2703510848], length 0
18:19:45.681222 IP 209.58.148.226.61157 > 172.31.45.22.5005: Flags [.], ack 2, win 2064, options [nop,nop,TS val 1661525026 ecr 2703510849], length 0
18:19:45.681313 IP 209.58.148.226.61158 > 172.31.45.22.5005: Flags [.], ack 2, win 2064, options [nop,nop,TS val 1661525026 ecr 2703510849], length 0
18:19:45.681931 IP 209.58.148.226.61150 > 172.31.45.22.5005: Flags [.], ack 2, win 2064, options [nop,nop,TS val 1661525026 ecr 2703510849], length 0
18:19:45.682416 IP 209.58.148.226.61144 > 172.31.45.22.5005: Flags [.], ack 2, win 2064, options [nop,nop,TS val 1661525026 ecr 2703510849], length 0
18:19:45.682420 IP 209.58.148.226.61149 > 172.31.45.22.5005: Flags [.], ack 2, win 2064, options [nop,nop,TS val 1661525026 ecr 2703510849], length 0
18:19:45.682746 IP 209.58.148.226.61155 > 172.31.45.22.5005: Flags [.], ack 2, win 2064, options [nop,nop,TS val 1661525028 ecr 2703510849], length 0
18:19:45.682813 IP 209.58.148.226.61159 > 172.31.45.22.5005: Flags [.], ack 2, win 2064, options [nop,nop,TS val 1661525028 ecr 2703510850], length 0
18:19:45.682933 IP 209.58.148.226.61154 > 172.31.45.22.5005: Flags [.], ack 2, win 2064, options [nop,nop,TS val 1661525028 ecr 2703510850], length 0
18:19:45.684309 IP 209.58.148.226.61148 > 172.31.45.22.5005: Flags [.], ack 2, win 2064, options [nop,nop,TS val 1661525028 ecr 2703510851], length 0
18:19:45.684360 IP 209.58.148.226.61147 > 172.31.45.22.5005: Flags [.], ack 2, win 2064, options [nop,nop,TS val 1661525028 ecr 2703510851], length 0
18:19:47.111092 IP 209.58.148.226.61143 > 172.31.45.22.5005: Flags [F.], seq 1, ack 2, win 2064, options [nop,nop,TS val 1661526451 ecr 2703510844], length 0
